<?xml version="1.0" encoding="iso-8859-1"?>
<templates xmlns="http://www.w3schools.com" xmlns:xsi="http://www.w3.org/2001/XMLSchema-instance" xsi:schemaLocation="http://www.w3schools.com template.xsd"><looknfeel id="lifeAndStyleSubcatLook">
		<sections>
			<section id="s1">
				<heading/>
			
				<subcategoryLink>Ib5P2DsM</subcategoryLink>
			</section>
			
			<section id="s2">
				<heading/>
			
				<subcategoryLink>Ib5P2DsM</subcategoryLink>
			</section>
			
			<section id="s3">
				<heading/>
			
				<subcategoryLink>Ib5P2DsM</subcategoryLink>
			</section>
			
			<section id="s4">
				<heading/>
			
				<subcategoryLink>Ib5P2DsM</subcategoryLink>
			</section>
			
			<section id="s5">
				<heading/>
			
				<subcategoryLink>Ib5P2DsM</subcategoryLink>
			</section>
			
			<section id="s6">
				<heading/>
			
				<subcategoryLink>Ib5P2DsM</subcategoryLink>
			</section>
			
			<section id="s7">
				<heading/>
			
				<subcategoryLink>Ib5P2DsM</subcategoryLink>
			</section>
		</sections>
	</looknfeel></templates>
