<?xml version="1.0" encoding="iso-8859-1"?>
<templates xmlns="http://www.w3schools.com" xmlns:xsi="http://www.w3.org/2001/XMLSchema-instance" xsi:schemaLocation="http://www.w3schools.com template.xsd"><looknfeel id="lifeAndStyleLook">
		<sections>
			<section id="s1">
				<heading>Fashion &amp; Style</heading>
			
				<subcategoryLink>QRo5SSHc</subcategoryLink>
			</section>
			
			<section id="s2">
				<heading>Food &amp; Drinks</heading>
			
				<subcategoryLink>kleAWDdR</subcategoryLink>
			</section>
			
			<section id="s3">
				<heading>Africa</heading>
			
				<subcategoryLink>4fgrkFh_</subcategoryLink>
			</section>
			
			<section id="s4">
				<heading>America</heading>
			
				<subcategoryLink>Pc1_SVp3</subcategoryLink>
			</section>
			
			<section id="s5">
				<heading>Europe</heading>
			
				<subcategoryLink>bPmTU0wy</subcategoryLink>
			</section>
			
			<section id="s6">
				<heading>Asia</heading>
			
				<subcategoryLink>51EI___F</subcategoryLink>
			</section>
			
			<section id="s7">
				<heading>more from fashion &amp; style  around the world</heading>
			
				<subcategoryLink>Ib5P2DsM</subcategoryLink>
			</section>
		</sections>
	</looknfeel></templates>
